title,review
"Easy transition, great phone.","The phone itself is very good however the battery life just like any other smartphone as awful as long as you get an external battery case such as a power bear or something else that you can charge it while using it it worked wonderfully lots of nice features"
"Good features and expecially battery life. Stays charged for two days or longer, depending how I'm using it.","It does everything I expect. It is easier to use than the mini droid I was using. Now all I have to do is figure out what all it can do. If I can't figure it out I will make contact or check on website."
"Easy to use. Just like my old phone.","I use this phone for my work - texting, google maps, internet, etc. Work and I do alot of texting back and forth."
"Does everything as advertised and more","Loving my new phone, the camera takes awesome pictures. I also really like the finger print sign in. Over all I'm enjoying my new phone."
"This phone is so easy to use. I absolutely love it and highly recommend this phone to everyone.","I have had nothing but iPhones for many yeats, so the transition over to an android was a huge step for me. I was amazed at how easy to use this phone really is. The apps are easy to locate and download. The storage is huge and the camera is crystal clear. I am still in awe and have shown all of my iPhone using friends how fast and easy this phone is. I'm hooked forever!!"
"Great features, and long battery life.","Excellent service and I have no been with Verizon long enough to determine if my satisfaction will continue. Hope I will continue to receive good service and will enjoy our relationship for years to come."
"Great","My son loves his new phone. He's very glad to have a phone that works. Thank you for great customer service!"
"New Galaxy Phone","I like fact that you can chose to let members of group conversation see responses. Like when I delete e=mails on phone it deletes from my computer. Old phone didn't do that."
"Great Phone","Very easy to use I've only had this phone a few weeks but the ease of use after owning the S5 for years... upgrading was definitely to my advantage"
"very fast and nice features","a big upgrade for me and im completely satisfied with. phone is very fast, plenty of awesome features with a good design. waterproof."
"Awesome phone","I really love this phone it's fast and the picture on it is so clear the processing on it is very fast."
"Very easy to operate. Only a few system apps were installed. Great phone!!","Easy, light, and just the right size to handle. Apps are quick to load and easy to find on pages. The color selection is also a positive for those who don't want just a black phone."
"Love my new s7 phone","I love all the new features it has and so more up to date then my old one , I like the new style easy to hold in your hand and also takes beautiful pictures ."
"Easy transition because rep transferred everything over. This is big in my book.","Samsung has gone above and beyond other phones. They can not compete with Samsung. Easy to understand and easily communicates/integrates with other operating systems."
"Awesome","Camera isn't as good as I wanted it to be but still better then my iPhone! Over all I really love the phone !"
"Great upgrade!","The Galaxy S7 was a perfect upgrade from my previous phone, a Galaxy S4. The operating system is easy to navigate and similar enough to the previous versions that it was not hard to adjust to at all. And the battery life is so much better!!"
"Love it!","The phone and video is great. The phone is fast. The sound is clear. It is a great phone. I love it and how it works!!!"
"Great phone","I love everything about my new Samsung Galaxy S7. It's a good phone with great features. I like the sleek design of the phone."
"Galaxy S7","Sooooooooo much better than the Droid turbo 2 which was suggested for my last phone! Disappointed by that suggestion from the Waterloo store, assured me it was just like my Galaxy"
"Getting to know Nougat","Sill getting to know the phone but I am very impressed thusfar. Just transitioned to Nougat, no manual available yet, so learning as I go."
"My New Galaxy 7","My friends told me I would regret waiting so long to upgrade...now I know they were right. I love the phone...all aspects and features."
"Definitely worth the money","I've had the phone about 2 weeks now, and I'm very happy that I went with this phone. The colors are sharp. The battery lasts all day, even when traveling and using it. The Gold color is gorgeous! It was VERY simple to transfer all of my old phone to this one, even with switching carriers, I was extremely impressed with that part. I had considered the Edge, but went with this one because I can be a tad clumsy and I'm glad that I did because I've already dropped this one and not caused any damage to it. I have a simple case for it (because it matches the phone) and the InvisiGlass(?) front screen cover, but that's it. Overall, this is an awesome phone!"
"I'm pleased with my phone but the only concern I have is that it shut off twice by itself","Best phone I've ever owned! Prior to purchasing the S7 I owned the S5 and I am equally satisfied with both products!"
"Best purchase ever","My grandaughter talked me into getting this phone and I really glad she did. I'm still learning how to use it but I love it."
"Good product","I like Samsung products much more than my previous product. This phone is fast and doesn't lag in any way. Perfect for what I use it for."
"S&","love the phone, works great, looks terrific. Way better than the phone I had before and I liked it a lot."
"I finally found a phone that my wife likes and can operate","I have tried other carriers I have tried other phones I've been with Verizon 12 years they have always been there and I will continue with Verizon and Samsung phones"
"I love this S7!","Everything so far I love about this phone. I love that Samsung keeps a charger that is universal to Android (unlike Apple) The 32 gb is great. It is a sturdy and water resistant phone."
"Best phone I have ever owned","Much brighter and clearer screen. Camera is a big step up to my old S5 phone news. Well worth price of the upgrade."
"Love this phone!","It has a bigger screen than the s6 edge. The screen quality is much better, more crisp. Pictures are wonderful! And I don't have to worry about accidentally spilling anything on it where it's waterproof! So far so good!!"
"My first smartphone.","Still learning how to use it, not sure I'll ever use it to it's full capacity. It seems intuitive, fairly easy to work through the process when using a new feature. As time goes it should become a more comfortable tool."
"New s7","Galaxy s7 has many good features. Ease of use is good. Photos are great. Takes time to learn all the things it can do and to set every up the way you want it. Worth the time."
"Great phone","Easy to use and set up. Beautiful graphics. I'd have preferred a smaller size but this one fits in my pocket without much trouble."
"my s7","great phone, no problems yet good features no compaints.................................................................................................."
"Awesome phone!","Had an S3 then S5, now S7. Transitions have been super easy. Am definitely Samsung user for life. I cannot do apple."
"Easy to transition from old phone to Galaxy S7","I like that I no longer have to bring along my tablet. My new phone phone has all the features I need, and then some. I'm sure I will be learning about all it's features for quite some time."
"Love it","Best choice for a phone for the money . Good screen,great sound the best phone I have ever had service is great"
"Easy to use","I love the galaxy s-7 It's really easy to use products line for it is good and there is alot of different things available to use"
"I love the s7","I took these three deer in Florida over the past few years and have the one I took this year being mounted."
"Great phone!","No problems. Works as expected. Easy to use if you're used to the Samsung devices. Comes in gold and white options. Good memory space."
"Great phone","The phone is a improvement from 6-'s Sam Sung. Battery life good. Fun phone. I like using camera for dj events."
"Fast easy and practical phone!","I upgraded from a really old galaxy s2 and I knew anything I got would be better. I'm glad Verizon has a new plan so my bill ended up the same with the new phone payments and insurance. Only thing I don't like is the sim and SD card loading tray."
"Was an easy transition from my old phone","I haven't had enough time yet to learn all the features. The features I have used were easy to transition from my old galazy 4"
"Samsung Galaxy S 7","I am impressed with the various facilities afforded by this phone. That includes the battery life and camera."
"Galaxy s7","So far, I love this phone. The battery life is so much better than the s5, which is what I had before."
"Easy to use","Easy to use, ease of transition from old phone since we were using a Samsung S4 and ungraded to a S7. The new software is extremely fast."
"Very pleased with function and form of GS7","Slightly smaller, which is actually a good thing, than the GS5 I had before. Fits in the pocket more smoothly. Operation-wise, it's fast to boot up, battery lasts a good long while, and it's generally an improvement on the older Galaxy models. Very pleased."
"Awesome phone","This phone does a lot of things, a bunch of things I probably don't even know about yet. Go s7!!!!!!"
"Love how easy it is to use.","It's got alot of fantastic features. Love the quality. Would love to learn more about what other features it offers.."
"Love Galaxy S7","This phone is a little smaller than the S5 & I am not a fan of the slight curve to the phone's edge, but every other feature is excellent. I thought my old phone took good pictures but this one is outstanding! The battery life is much better!"
"Great phone & easy to use !","This phone is easy to use and has some upgrades from my s6 like email functions, which are important since I am a manager and use my phone a lot for my job. I love it"
"Great additional internal storeage","I needed to replace my Galaxy S4, due to lots of redundant issues. I narrowed my choices to The S7, Google's Pixel and an I phone 7. I am so glad i made the choice i did. Everything is really good on the S7, especially the camera. I have problems holding my phone still due to shakiness. Even when I zoom in to 8x the picture is very steady."
"What's there not to like?!","I cannot put enough words to describe my love for the phone. To make it easier I'll list my only one complaint. Battery life...but beyond that, the phone is amazing!"
"Phone","Good live my new phone price was good fast on line pictures show well need to receive something free"
"Fabulous phone that is easy to use!","I would recommend Verizon. Great customer care, fair prices. Easy to work with. The two main things I look for as a customer are excellent customer care and affordable prices. Those are the two main qualities I look for when choosing to do business with any company and Verizon has them in abundance. Very proud to be a new Verizon customer."
"Faster and smoother than my beloved S5.","My new S7 is faster and smoother than my beloved S5. I ride my mobile devices into the ground and traded in my S5 only when it started heating up at inconvenient times, such as when my wife is trying to reach me. Anyway, I love the S7 so far. Using it is effortless."
"wonderful!!!","Everything I hoped it would be. The size of the phone,the weight and sound is great. I feel this phone is a great value."
"I love my phone","My phone does much more than you last android as well as look better, the screen itself was a hazard. But overall I am enjoying this product and look forward to the great customer service that I have not been receiving from my last service provider."
"S7","I love my phone ! Way better service then other companies in my area. Friendly staff and fast service"
"It is like my old phone (so easy to use)...but 100 times better","Every day, I find a new use for my phone. It was easy to transition to but it has so many added features. It helps me at school as a timer, I love the beautiful pictures that it takes, I love that it is so thin and the screen is larger...I Just Love It!!!!!!!"
"Samsung Galaxy s7","I enjoy this product a lot wish it was a little bigger and had it's own stylist. I enjoy that the phone is so smart."
"Nice Phone Samsung G7","Nice Phone....sleek and easy to use. Had no problem transferring data from old phone. I would recommend this phone to all my friends and family. It serves my needs"
"easy to use fast and snappy","very well built phone top of the line, fast and snappy, easy to navigate, like apps and the health app is awesome"
"Every Samsung Galaxy Gets Better!","The Samsung Galaxy 7 is my third Galaxy phone. I had the S3 and the S5. I was happy with all of them, but they improve with with each upgrade. I am happy with the 32 MB memory, as I had 16MB in the past. I do not like the non-removable battery. I hope this battery lasts. I like the time on the lock screen. And something as small as a small bump on the charging cord that lets me know which way is up when inserting it in the phone in the dark, is a plus for me. The fast charging is also a plus. There were no decisions to be be made. A Samsung 7 was going to be my next phone."
"Was an easy transition.","So far it has been easy to use, A little getting used to coming from the Samsung Convoy flip phone. But was fairly adept to is in just a couple of hours. If it holds up as well as the Convoy, then all should be good."
