category,rating,starting_price,subcategory,language,title,url,seller,pos_rating,num_reviews,location,ave_reponse_time
Fun & Lifestyle,rating-circles star-rating-s12 rate-10,$5,Online Lessons,,I will be your biology and sociology writer,https://www.fiverr.com/yasirakhan/do-your-biology-quizes-and-assignments-for-you,yasirakhan,97%,(63),Pakistan,1 Hrs.
Fun & Lifestyle,rating-circles star-rating-s12 rate-10,$5,Online Lessons,English,I will assist you in civil engineering problems,https://www.fiverr.com/phambra1/assist-you-in-civil-engineering-problems,phambra1,99%,(8),United Kingdom,1 Hrs.
Fun & Lifestyle,,$5,Global Culture,English,I will be you virtual assistant and online researcher,https://www.fiverr.com/shabizuey/be-you-virtual-assistant-and-online-researcher,shabizuey,,,Philippines,1 Week +
Fun & Lifestyle,,$5,Global Culture,"English, Vietnamese",I will place a reservation for you in Kien Giang and more things,https://www.fiverr.com/nathanwu/place-a-reservation-for-you-in-kien-giang-and-more-things,nathanwu,,,Vietnam,1 Hrs.
Programming & Tech,,$5,User Testing,English,I will help you test your site from a user perspective,https://www.fiverr.com/frederickdabo/help-you-test-your-site-from-a-user-perspective,frederickdabo,,,Nigeria,1 Hrs.
Graphics & Design,rating-circles star-rating-s12 rate-10,$5,Illustration,,I will do Adobe illustrator work,https://www.fiverr.com/rokibul2018/vectorize-your-graphic-to-ai-pdf-eps-or-psd-file,rokibul2018,99%,(74),Bangladesh,1 Hrs.
Fun & Lifestyle,,$5,Global Culture,"English, Thai",I will send you a personal postcard from Bangkok,https://www.fiverr.com/nuttanicha/send-you-a-personal-postcard-from-bangkok,nuttanicha,100%,,Thailand,7 Hrs.
Programming & Tech,,$5,User Testing,"English, Croatian, German",I will test the functionality of your website and write a report,https://www.fiverr.com/tomimarket/test-the-functionality-of-your-website-and-write-a-report,tomimarket,100%,,Croatia,7 Hrs.
Programming & Tech,,$10,User Testing,"English, Marathi, Hindi",I will perform Black Box Testing,https://www.fiverr.com/rajendrashrowty/black-box-software-testing,rajendrashrowty,,,India,1 Hrs.
Fun & Lifestyle,,$5,Global Culture,"Spanish, English",I will plan your Trip to South America,https://www.fiverr.com/coachmarketing/plan-your-trip-to-south-america,coachmarketing,,,Uruguay,5 Days
Programming & Tech,,$800,User Testing,"English, Romanian, Russian",I will perform System Testing of your application,https://www.fiverr.com/alexandrmaxiuta/perform-system-testing-of-your-application,alexandrmaxiuta,,,Moldova,1 Hrs.
Fun & Lifestyle,,$5,Global Culture,"English, Thai",I will send you sweets snacks and toys from Thailand,https://www.fiverr.com/nuttanicha/send-you-sweets-snacks-and-toys-from-thailand,nuttanicha,100%,,Thailand,7 Hrs.
Programming & Tech,,$5,User Testing,"Bengali, English, Hindi",I will use ur product and check for bugs and issues,https://www.fiverr.com/avik_tk/use-ur-product-and-check-for-bugs-and-issues,avik_tk,,,India,1 Hrs.
Fun & Lifestyle,,$5,Global Culture,English,I will plan your Disney World trip,https://www.fiverr.com/elarence/plan-your-disney-world-trip,elarence,,,United States,1 Hrs.
Programming & Tech,,$5,User Testing,English,"I will do software,mobile and website TESTING at all most of the platforms",https://www.fiverr.com/jeffinokoshy/do-software-mobile-and-website-testing-at-all-most-of-the-platforms,jeffinokoshy,,,India,1 Hrs.
Programming & Tech,,$5,User Testing,"English, Chinese",I will make a new kerbal craft file,https://www.fiverr.com/frankhohippo/make-a-new-kerbal-craft-file,frankhohippo,,,Taiwan,1 Hrs.
Programming & Tech,,$5,User Testing,English,I will test your website from a user perspective,https://www.fiverr.com/tobiufon/test-your-website-from-a-user-perspective,tobiufon,,,Nigeria,1 Hrs.
Programming & Tech,,$5,User Testing,"Spanish, English",I will test your program or app,https://www.fiverr.com/leopelozo/test-your-program-or-app,leopelozo,98%,,Argentina,1 Hrs.
Programming & Tech,,$5,User Testing,English,I will do user testing for checking  you websites usability,https://www.fiverr.com/aayush523/do-user-testing-for-checking-you-websites-usability,aayush523,,,India,1 Hrs.
Programming & Tech,,$5,User Testing,English,I will search for bugs on your site or app,https://www.fiverr.com/chrisbru/search-for-bugs-on-your-site-or-app,chrisbru,,,United Kingdom,1 Hrs.
Programming & Tech,,$50,User Testing,"Danish, English (uk), German",I will do all basic tasks,https://www.fiverr.com/johanneneerup/do-all-basic-tasks,johanneneerup,,,Denmark,1 Hrs.
Programming & Tech,,$10,User Testing,English,I will test your software and website from a users perspective,https://www.fiverr.com/sociogeek/test-your-software-and-website-from-a-users-perspective,sociogeek,,,Nigeria,1 Hrs.
Graphics & Design,rating-circles star-rating-s12 rate-10,$5,Cartoons & Caricatures,English,I will create 2d sprite sheet  for you,https://www.fiverr.com/elangkarosingo/2d-sprite-sheet-animation,elangkarosingo,99%,(63),Indonesia,1 Hrs.
Programming & Tech,,$5,User Testing,English,I will perform a Heuristic evaluation for your web or mobile app,https://www.fiverr.com/haseeb1278/perform-a-heuristic-evaluation-for-your-web-or-mobile-app,haseeb1278,,,Pakistan,5 Hrs.
Graphics & Design,rating-circles star-rating-s12 rate-10,$5,Logo Design,"English, Urdu",I will design MODERN logo  for you,https://www.fiverr.com/zareen_khan/design-modern-logo-design-for-you,zareen_khan,99%,(377),Pakistan,1 Hrs.
Programming & Tech,,$100,User Testing,English,I will do user testing for you,https://www.fiverr.com/tblount28/do-user-testing-for-you,tblount28,,,United States,1 Hrs.
Fun & Lifestyle,,$5,Global Culture,"German, English (uk)",I will send a postcard from Malta,https://www.fiverr.com/maltaassistant/send-a-postcard-from-malta,maltaassistant,,,Malta,1 Hrs.
Fun & Lifestyle,,$10,Global Culture,"English, Hindi, Spanish, Kannada",I will make the best travel plan in india,https://www.fiverr.com/srinivaskavitha/make-the-best-travel-plan-in-india,srinivaskavitha,100%,,India,5 Hrs.
Fun & Lifestyle,rating-circles star-rating-s12 rate-10,$5,Astrology & Readings,,I will do a future PSYCHIC reading for anything,https://www.fiverr.com/johnnycake100/tell-you-accurately-your-future?context=adv.cat_7.subcat_78&context_type=rating&source=gallery-listing&ref_ctx_id=f276ef0c-7dc0-49e0-8919-498b9117748c&filtered_price=&pckg_id=1&pos=45&funnel=17563d73-772c-405c-b8d4-c87459fdcb67,johnnycake100,99%,(534),Jamaica,1 Hrs.
Graphics & Design,rating-circles star-rating-s12 rate-10,$5,Vector Tracing,,I will convert any photo to vector photo,https://www.fiverr.com/almurad459/convert-any-photo-to-vector-photo,almurad459,97%,(11),Bangladesh,1 Hrs.
Programming & Tech,,$5,User Testing,"English, Hindi",I will test the usability of the website features,https://www.fiverr.com/abidahabib/test-the-usability-of-the-website-features,abidahabib,,,India,1 Hrs.
Graphics & Design,rating-circles star-rating-s12 rate-10,$5,Logo Design,English,I will design Company Business Brand Website Logo,https://www.fiverr.com/issy_designer/design-perfect-modern-logo,issy_designer,96%,(2118),Pakistan,1 Hrs.
Fun & Lifestyle,,$5,Global Culture,English,I will make for you a personalized beach postcard,https://www.fiverr.com/nickfahrenheit/make-for-you-a-personalized-beach-postcard,nickfahrenheit,,,United States,1 Hrs.
Fun & Lifestyle,,$5,Global Culture,"French, English, German",I will send you a postcard from Paris,https://www.fiverr.com/milenaalex/send-you-a-postcard-from-paris,milenaalex,,,France,11 Hrs.
Programming & Tech,,$5,User Testing,"English, Spanish, Hebrew",I will test your mobile app or website to assess usability,https://www.fiverr.com/joshmweinstein/test-your-mobile-app-or-website-to-assess-usability,joshmweinstein,,,United States,1 Hrs.
Programming & Tech,,$5,User Testing,"English, Irish, French","I will test new games, applications and websites",https://www.fiverr.com/walshy997/test-new-games-applications-and-websites,walshy997,,,Ireland,1 Hrs.
Programming & Tech,,$30,User Testing,English,I will pentest and help with vulnerability analysis,https://www.fiverr.com/megactech/pentest-and-help-with-vulnerability-analysis,megactech,,,Nigeria,1 Hrs.
Graphics & Design,rating-circles star-rating-s12 rate-10,$5,Logo Design,"English, English (uk)",I will design PREMIUM logo with Transparent file,https://www.fiverr.com/madison_87/create-a-awesome-and-professional-logo-for-your-company-identity,madison_87,98%,(1059),United States,1 Hrs.
Fun & Lifestyle,,$5,Global Culture,English,I will find the best info about your travel destination,https://www.fiverr.com/yourtravelguide/find-the-best-info-about-your-travel-destination,yourtravelguide,,,United States,1 Hrs.
Programming & Tech,,$5,User Testing,English,I will test your website from users perspective,https://www.fiverr.com/mahnoorsaeed/test-your-website-from-users-perspective,mahnoorsaeed,,,Pakistan,1 Hrs.
Programming & Tech,,$5,User Testing,"English (uk), Hindi, Tamil, English",I will test the website under multiple user load,https://www.fiverr.com/nikunj_rathi/test-the-website-under-multiple-user-load,nikunj_rathi,,,India,1 Hrs.
Programming & Tech,,$5,User Testing,English,I will test your website and unlock your customers insight,https://www.fiverr.com/techmastr/test-your-website-and-unlock-your-customers-insight,techmastr,,,United States,1 Hrs.
Graphics & Design,rating-circles star-rating-s12 rate-10,$25,Logo Design,English,I will design retro vintage logo,https://www.fiverr.com/elenora/do-vintage-retro-logo,elenora,99%,(463),United States,3 Hrs.
Fun & Lifestyle,,$5,Global Culture,"Polish, English, Thai",I will find the cheapest airline ticket,https://www.fiverr.com/andrzejk85/find-the-cheapest-airline-ticket,andrzejk85,93%,,Thailand,1 Hrs.
Fun & Lifestyle,,$5,Global Culture,"English (uk), Spanish",I will answer your questions about Spain,https://www.fiverr.com/lauligrazia/answer-your-questions-about-spain,lauligrazia,100%,,Spain,5 Hrs.
Fun & Lifestyle,,$5,Global Culture,English,I will write a travel article for your Srilankan travel,https://www.fiverr.com/dineshmadhushan/write-a-travel-article-for-your-srilankan-travel,dineshmadhushan,97%,,Sri Lanka,14 Hrs.
Fun & Lifestyle,,$5,Global Culture,"English, French, Italian, Khmer","I will send you a postcard from Phnom Penh, Cambodia",https://www.fiverr.com/patatalofineser/send-you-a-postcard-from-phnom-penh-cambodia,patatalofineser,,,Vietnam,15 Hrs.
Programming & Tech,,$20,User Testing,"English, Spanish",I will test your business website,https://www.fiverr.com/charannanduri/test-your-business-website,charannanduri,,,United States,1 Hrs.
Digital Marketing,,$300,Marketing Strategy,"English, Italian, Ukrainian, German",I will plan the Marketing Strategy for your Business or company,https://www.fiverr.com/proactivelancer/translate-in-any-language-and-vice-versa,proactivelancer,99%,,Pakistan,6 Hrs.
Fun & Lifestyle,,$5,Global Culture,English,I will create a postcard for you with any picture,https://www.fiverr.com/vennaryreynolds/create-a-postcard-for-you-with-any-picture,vennaryreynolds,,,Jamaica,5 Days
Fun & Lifestyle,,$5,Global Culture,English,"I will send a postcard from Memphis, Tennessee",https://www.fiverr.com/couturepost/send-a-postcard-from-memphis-tennessee,couturepost,,,United States,1 Hrs.
Fun & Lifestyle,,$5,Global Culture,"English, Vietnamese",I will give you 5 picture about Saigon landmark,https://www.fiverr.com/tienduc/give-you-5-picture-about-saigon-landmark,tienduc,,,Vietnam,1 Hrs.
Fun & Lifestyle,,$5,Global Culture,"English, Hindi, Kashmiri",I will send offbeat photos of Chicago,https://www.fiverr.com/chicago_girl/send-off-beat-photos-of-chicago,chicago_girl,,,United States,4 Days
Fun & Lifestyle,rating-circles star-rating-s12 rate-10,$5,Astrology & Readings,,I will cast an extremely powerful breakup spell to breakup any relationship,https://www.fiverr.com/modernwitch/cast-an-extremely-powerful-breakup-spell-to-breakup-any-relationship?context=adv.cat_7.subcat_78&context_type=rating&source=gallery-listing&ref_ctx_id=f276ef0c-7dc0-49e0-8919-498b9117748c&filtered_price=&pckg_id=1&pos=44&funnel=17563d73-772c-405c-b8d4-c87459fdcb67,modernwitch,100%,(349),Canada,11 Hrs.
Graphics & Design,rating-circles star-rating-s12 rate-10,$5,Infographics,,I will create Info Graphic or PowerPoint Presentation,https://www.fiverr.com/designclub04/create-eye-catching-professional-info-graphic-asap,designclub04,98%,(167),India,1 Day
Fun & Lifestyle,rating-circles star-rating-s12 rate-10,$5,Online Lessons,,I will provide all kinds of academic assistance for psychology,https://www.fiverr.com/yasirakhan/do-your-psychology-quizes-and-assignments-for-you,yasirakhan,97%,(9),Pakistan,1 Hrs.
Programming & Tech,,$5,User Testing,English,I will test your android app,https://www.fiverr.com/akib134/test-your-android-app,akib134,,,Bangladesh,1 Hrs.
Fun & Lifestyle,,$5,Global Culture,English,"I will send a postcard from Bangkok, Thailand with hand write of your message",https://www.fiverr.com/yourpeachy/send-a-postcard-from-bangkok-thailand-with-hand-write-of-your-message,yourpeachy,100%,,Thailand,1 Hrs.
Fun & Lifestyle,rating-circles star-rating-s12 rate-10,$5,Astrology & Readings,,I will cast a powerful customized WITCHCRAFT or Wiccan spell of your choice,https://www.fiverr.com/modernwitch/cast-a-powerful-witchcraft-spell-of-your-choice,modernwitch,100%,(99),Canada,11 Hrs.
Fun & Lifestyle,,$5,Global Culture,English,I will tell you 5 things that you dont know about Jamaica,https://www.fiverr.com/charlespch/tell-you-5-things-that-you-dont-no-about-jamaica,charlespch,,,Jamaica,1 Hrs.
Programming & Tech,,$5,User Testing,English,"I will test the quality of your website, web or mobile app",https://www.fiverr.com/twenty3bit/test-the-quality-of-your-website-webapp-or-mobile-app,twenty3bit,,,Philippines,1 Hrs.
Fun & Lifestyle,,$5,Family & Genealogy,English,I will give you the guide that every new parent must have,https://www.fiverr.com/raymonddevio/give-you-the-guide-that-every-new-parent-must-have?context=adv.cat_7.subcat_287&context_type=rating&source=gallery-listing&ref_ctx_id=1c2d33d1-e7ca-4346-ae18-d9b9025f12a8&filtered_price=&pckg_id=1&pos=24&funnel=22e45a15-2226-42b7-9b74-9da97c06a636,raymonddevio,,,Philippines,2 Hrs.
Programming & Tech,,$5,User Testing,English,I will rigorously test your website,https://www.fiverr.com/lmatter41/rigorously-test-your-website,lmatter41,20%,,Australia,1 Hrs.
Programming & Tech,,$5,User Testing,English,I will check website and software,https://www.fiverr.com/nayan3446/check-website-and-software,nayan3446,,,United States,1 Hrs.
Graphics & Design,rating-circles star-rating-s12 rate-9,$5,Vector Tracing,English,I will make raster to vector with tracingin 1 hour,https://www.fiverr.com/puneet23015/make-raster-to-vector-with-tracing,puneet23015,97%,(45),India,1 Hrs.
Fun & Lifestyle,,$5,Global Culture,"English, Hindi, Arabic, Persian",I will tour Adviser in india for Historical heritage Places,https://www.fiverr.com/cellspare/tour-adviser-in-india-for-historical-place,cellspare,,,India,1 Hrs.
Fun & Lifestyle,,$5,Global Culture,"English, Sinhala, sinhalese",I will guide you to travel any place in Sri Lanka,https://www.fiverr.com/hasi94/guide-you-to-travel-any-place-in-sri-lanka,hasi94,,,Sri Lanka,1 Hrs.
Programming & Tech,,$5,User Testing,"English, Hindi",I will test Your Android Or IOS App and Game,https://www.fiverr.com/techxjunkie/test-your-android-and-ios-app-or-game,techxjunkie,,,India,2 Hrs.
Programming & Tech,,$5,User Testing,"English, English (uk)",I will test your website from A to Z,https://www.fiverr.com/precious482/test-your-website-from-a-to-z,precious482,,,Pakistan,1 Hrs.
Programming & Tech,,$5,User Testing,English,I will test your website and mobile app,https://www.fiverr.com/yubeisycg/test-your-website-and-mobile-app,yubeisycg,,,Venezuela,1 Hrs.
Fun & Lifestyle,rating-circles star-rating-s12 rate-10,$5,Astrology & Readings,,I will cast a luck spell or the gamblers lucky money spell,https://www.fiverr.com/modernwitch/cast-a-luck-spell-or-the-gamblers-lucky-money-spell,modernwitch,100%,(155),Canada,11 Hrs.
Fun & Lifestyle,,$5,Global Culture,"English, Hindi, Panjabi",I will answer questions about INDIA,https://www.fiverr.com/drharjotcaur/answer-your-5-queries-on-india,drharjotcaur,100%,,India,10 Hrs.
Fun & Lifestyle,,$5,Global Culture,English,"I will give u advice to travel in East Europe ,Greece, Romania , Bulgaria , and so on",https://www.fiverr.com/simioniuc/give-u-advice-to-travel-in-east-europe-romania-bulgaria-and-so-on,simioniuc,99%,,Romania,2 Hrs.
Graphics & Design,rating-circles star-rating-s12 rate-10,$5,Vector Tracing,English,I will convert to vector your graphic ideas,https://www.fiverr.com/akvector/vectorize-your-image-or-sketch-in-2-days,akvector,99%,(55),Latvia,2 Hrs.
Graphics & Design,rating-circles star-rating-s12 rate-10,$5,Logo Design,English,I will design premium MINIMALIST logo,https://www.fiverr.com/sajid3222/create-a-eye-catching-and-professional-logo,sajid3222,97%,(2143),Pakistan,4 Hrs.
Programming & Tech,,$5,User Testing,,I will test your free android app as a user,https://www.fiverr.com/domdm123/test-your-free-android-app-as-a-user,domdm123,91%,,United Kingdom,1 Hrs.
Programming & Tech,,$5,User Testing,English,I will have 5 Testers Test Your Website Usability And Suggest Improvements,https://www.fiverr.com/akshayraina/have-5-testers-test-your-website-usability-and-suggest-improvements,akshayraina,,,India,1 Hrs.
Programming & Tech,,$15,User Testing,"English, Serbian, Croatian, Bosnian","I will test your sites from a user side,report on any mistakes",https://www.fiverr.com/stefkee/test-your-sites-from-a-user-side-report-on-any-mistakes,stefkee,,,Serbia,1 Hrs.
Programming & Tech,,$5,User Testing,"English, Hindi",I will test your website and will find bugs and errors,https://www.fiverr.com/maahii/test-your-website-and-can-find-bugs-and-errors,maahii,,,India,1 Hrs.
Fun & Lifestyle,,$5,Global Culture,English,I will create a postcard how you want and send it from Sri LANKA,https://www.fiverr.com/tecthejaa/send-you-a-post-card-from-sri-lanka,tecthejaa,,,Sri Lanka,1 Hrs.
Graphics & Design,rating-circles star-rating-s12 rate-10,$10,Logo Design,"English, Urdu",I will design Professional Badge logo,https://www.fiverr.com/adi_graphics196/design-professional-retro-and-badge-logo,adi_graphics196,98%,(1132),Pakistan,1 Hrs.
Programming & Tech,,$50,User Testing,English,I will test your mobile app and provide you bug  report,https://www.fiverr.com/dilipmehta/test-your-mobile-app-and-provide-you-bug-report,dilipmehta,,,India,1 Hrs.
Fun & Lifestyle,,$5,Global Culture,"English, French",I will send you a postcard from Paris,https://www.fiverr.com/french_homework/send-you-a-postcard-from-paris,french_homework,,,France,1 Day
Fun & Lifestyle,,$50,Global Culture,"English, French, Spanish, Arabic",I will be you guide on your trip to Africa and India,https://www.fiverr.com/happetul/be-you-guide-on-your-trip-to-africa-and-india,happetul,100%,,Malaysia,5 Hrs.
Programming & Tech,,$5,User Testing,"English, Tagalog","I will test your game, application, or website as a user",https://www.fiverr.com/paologoco/test-your-game-application-or-website-as-a-user,paologoco,,,Philippines,1 Hrs.
Fun & Lifestyle,,$10,Family & Genealogy,English,I will find a perfect baby name for you,https://www.fiverr.com/marketingmaniao/find-a-perfect-baby-name-for-you-47afd167-fb54-427d-a82c-74e6735f061b?context=adv.cat_7.subcat_287&context_type=rating&source=gallery-listing&ref_ctx_id=1c2d33d1-e7ca-4346-ae18-d9b9025f12a8&filtered_price=&pckg_id=1&pos=30&funnel=22e45a15-2226-42b7-9b74-9da97c06a636,marketingmaniao,97%,,Bangladesh,3 Hrs.
Fun & Lifestyle,,$5,Global Culture,"Spanish, English",I will plan an itinerary for your vacation using Travefy,https://www.fiverr.com/jross02/plan-an-itinerary-for-your-vacation-using-travefy,jross02,100%,,United States,1 Hrs.
Fun & Lifestyle,,$5,Global Culture,English,I will find you a cheap flight,https://www.fiverr.com/lola23400/find-you-a-cheap-flight,lola23400,,,United States,1 Hrs.
Programming & Tech,,$10,User Testing,English,I will fix bugs of your apps,https://www.fiverr.com/ghazanfarali666/fix-bugs-of-your-apps,ghazanfarali666,,,Pakistan,1 Hrs.
Programming & Tech,,$5,User Testing,"English, Urdu",I will test your android application,https://www.fiverr.com/ambrenandroid/test-your-android-application,ambrenandroid,,,Pakistan,1 Hrs.
Fun & Lifestyle,,$5,Global Culture,English,I will send postcard from Croatia cost,https://www.fiverr.com/njnets34dp/send-postcard-from-croatia-cost,njnets34dp,100%,,Croatia,9 Hrs.
Programming & Tech,,$5,User Testing,English,I will test your program or Website,https://www.fiverr.com/riversidebakery/test-your-program-or-business,riversidebakery,,,United States,1 Hrs.
Graphics & Design,rating-circles star-rating-s12 rate-10,$5,Cartoons & Caricatures,,I will draw your avatar from your photo,https://www.fiverr.com/frart09/draw-your-avatar-from-your-photo-92c53e67-0e1c-47a5-8fe8-482271909191,frart09,97%,(64),Indonesia,1 Hrs.
Fun & Lifestyle,,$5,Global Culture,English,I will create a tailor made travel itinerary,https://www.fiverr.com/scottgroga/create-a-tailor-made-travel-itinerary,scottgroga,,,United Arab Emirates,1 Hrs.
Fun & Lifestyle,,$5,Global Culture,"English, Polish, German",I will tell you anything about Cracow,https://www.fiverr.com/hanas96/tell-you-anything-about-cracow,hanas96,,,Poland,19 Hrs.
Programming & Tech,,$10,User Testing,"English, French, Arabic",I will perform Web Mobile And Network Penetration Testing,https://www.fiverr.com/nissrine1/perform-web-mobile-and-network-penetration-testing,nissrine1,,,Morocco,4 Days
Fun & Lifestyle,rating-circles star-rating-s12 rate-10,$5,Astrology & Readings,,I will cast an extremely POWERFUL Kabbalah Spell which will make your wish come true,https://www.fiverr.com/modernwitch/cast-an-extremely-powerful-kabbalah-spell-which-will-make-your-wish-come-true?context=adv.cat_7.subcat_78&context_type=rating&source=gallery-listing&ref_ctx_id=f276ef0c-7dc0-49e0-8919-498b9117748c&filtered_price=&pckg_id=1&pos=9&funnel=17563d73-772c-405c-b8d4-c87459fdcb67,modernwitch,100%,(640),Canada,11 Hrs.
Fun & Lifestyle,,$5,Global Culture,"English, Vietnamese",I will give you 5 images about Vietnam religion,https://www.fiverr.com/tienduc/give-you-5-images-about-vietnam-religion,tienduc,,,Vietnam,1 Hrs.
Programming & Tech,,$5,User Testing,English,I will promote your website to engage more people,https://www.fiverr.com/only4shuvo/promote-your-website-to-engage-more-people,only4shuvo,,,Bangladesh,1 Hrs.
Fun & Lifestyle,,$5,Global Culture,"English, German",I will send you an old and antique postcard from Sofia or Bulgaria,https://www.fiverr.com/alex_airbnb/send-you-an-old-and-antique-postcard-from-sofia,alex_airbnb,97%,,Bulgaria,1 Hrs.
Fun & Lifestyle,rating-circles star-rating-s12 rate-10,$10,"Health, Nutrition & Fitness","English, Arabic",I will make an individualized workout plan for you,https://www.fiverr.com/osamahadid/make-an-indivualized-workout-plan-for-you,osamahadid,100%,(2),United States,9 Hrs.
Programming & Tech,,$5,User Testing,"English, Arabic",I will test your app on ios or android,https://www.fiverr.com/mohammedessaam/test-your-app-on-ios-or-android,mohammedessaam,,,Egypt,1 Hrs.
Programming & Tech,,$5,User Testing,English,I will test your app or website and help you crush your bugs,https://www.fiverr.com/davidrecio/let-me-test-your-app-or-website-and-help-you-crush-your-bugs,davidrecio,,,United States,1 Hrs.
Graphics & Design,rating-circles star-rating-s12 rate-10,$5,Logo Design,"English, Urdu",I will create 3D logo in 2 hour,https://www.fiverr.com/aimeeerin/create-3d-logo-in-2-hour,aimeeerin,97%,(219),Pakistan,1 Hrs.
Programming & Tech,,$5,User Testing,"English, Ukrainian, Russian","I will test functionality, UI and usability of your app",https://www.fiverr.com/olexiizaychenko/test-functionality-ui-and-usability-of-your-web-site,olexiizaychenko,,,Ukraine,1 Hrs.
Programming & Tech,,$5,User Testing,"Spanish, German, English, French",I will provide assistance in any areas,https://www.fiverr.com/monarchp/provide-assistance-in-any-areas,monarchp,,,United States,1 Hrs.
Fun & Lifestyle,,$5,Global Culture,"English, Spanish, French",I will send you a handwritten postcard from Mexico,https://www.fiverr.com/itsmeweendy/send-you-a-handwritten-postcard-from-mexico,itsmeweendy,100%,,Mexico,12 Hrs.
Programming & Tech,,$5,User Testing,"Bengali, English",I will user testing to find problems with user experience,https://www.fiverr.com/sharifulsajib/user-testing-to-find-problems-with-user-experience,sharifulsajib,,,Bangladesh,2 Days
Fun & Lifestyle,,$5,Global Culture,English,"I will send you a postcard from Sri Lanka,pearl of Indian Ocean",https://www.fiverr.com/rukshan092/send-you-a-postcard-from-sri-lanka-pearl-of-indian-ocean,rukshan092,,,Sri Lanka,1 Week +
Graphics & Design,rating-circles star-rating-s12 rate-10,$5,Vector Tracing,"English, Indonesian",I will make STUNNING line art vector tracing,https://www.fiverr.com/dameankaka/make-stunning-line-art-of-your-photo,dameankaka,97%,(14),Indonesia,1 Hrs.
Fun & Lifestyle,,$5,Global Culture,English,I will send you a postcard from MOROCCO to anywhere,https://www.fiverr.com/mohamedbenaziz/send-you-a-postcard-from-morocco-to-anywhere,mohamedbenaziz,80%,,Morocco,9 Hrs.
Programming & Tech,,$20,User Testing,"English, Hindi, Panjabi, Spanish",I will find problems in android apps and websites,https://www.fiverr.com/bhupinderrules/find-problems-in-android-apps-and-websites,bhupinderrules,,,India,1 Hrs.
Programming & Tech,,$5,User Testing,"English, Spanish, French","I will test YOUR product with quality, balance and efficiency",https://www.fiverr.com/luisalejandrop/test-your-product-with-quality-balance-and-efficiency,luisalejandrop,,,Venezuela,1 Hrs.
