category,rating,starting_price,subcategory,language,title,url,seller,pos_rating,num_reviews,location,ave_reponse_time
Fun & Lifestyle,,$5,Global Culture,English,I will send you post cards from Sri Lanka,https://www.fiverr.com/bgunathilaka/send-you-post-cards-from-sri-lanka,bgunathilaka,,,Sri Lanka,4 Hrs.
Fun & Lifestyle,,$5,Global Culture,English,"I will plan your trip to Bangalore,India",https://www.fiverr.com/dipanwita/plan-your-trip-to-bangaloreindia,dipanwita,,,India,1 Hrs.
Programming & Tech,,$5,User Testing,English,I will tell you what i think about your website,https://www.fiverr.com/crossfire789/tell-you-what-i-think-about-your-website,crossfire789,,,United Kingdom,1 Hrs.
Fun & Lifestyle,,$5,Global Culture,"English, Russian",I will send you two original postcards for geeks from Russia,https://www.fiverr.com/ilovepersimmon/send-you-two-original-postcards-for-geeks-from-russia,ilovepersimmon,100%,,Russia,1 Hrs.
Fun & Lifestyle,,$5,Global Culture,"English, Indonesian",I will help you with anything about Indonesia,https://www.fiverr.com/adelwish/write-articles-about-anything-in-indonesia,adelwish,,,Indonesia,1 Hrs.
Programming & Tech,,$5,User Testing,English,I will test your application and mobile,https://www.fiverr.com/shuvamghosh/test-your-application-and-mobile,shuvamghosh,,,India,1 Hrs.
Graphics & Design,rating-circles star-rating-s12 rate-9,$5,Cartoons & Caricatures,English,I will draw your photo be a awesome cartoon,https://www.fiverr.com/wicak964/draw-your-photo-to-be-a-awesome-cartoon,wicak964,93%,(551),Indonesia,1 Day
Fun & Lifestyle,rating-circles star-rating-s12 rate-10,$5,Astrology & Readings,"English (uk), English",I will cast the Be Gone Now Powerful Magic Banishment Spell,https://www.fiverr.com/houseofspells/cast-the-be-gone-powerful-magic-banishment-spell,houseofspells,97%,(116),United States,2 Hrs.
Fun & Lifestyle,,$5,Global Culture,English,I will plan your trip to Sri Lanka,https://www.fiverr.com/niroshan_perera/tour-planning-sri-lanka,niroshan_perera,90%,,Sri Lanka,9 Hrs.
Fun & Lifestyle,,$5,Global Culture,English,I will send you happy mail from Jamaica,https://www.fiverr.com/lionessrebirth/create-english-literature-activities,lionessrebirth,50%,,Jamaica,1 Hrs.
Fun & Lifestyle,,$5,Global Culture,English,I will make a travel plan for your trip to Barcelona,https://www.fiverr.com/monicafedez/make-a-travel-plan-for-your-trip-to-barcelona,monicafedez,,,United States,1 Hrs.
Fun & Lifestyle,,$5,Global Culture,English,I will answer 5 travel questions,https://www.fiverr.com/monklapa/answer-5-travel-questions,monklapa,99%,,Australia,1 Day
Programming & Tech,,$5,User Testing,"English, Hindi",I will do overall testing of web and mob app,https://www.fiverr.com/ravi_1158/do-overall-testing-of-web-and-mob-app,ravi_1158,,,India,1 Hrs.
Programming & Tech,,$5,User Testing,English,I will user test your site for 9 UX essentials,https://www.fiverr.com/rodneygauna/test-the-user-experience-of-your-website,rodneygauna,,,United States,1 Hrs.
Fun & Lifestyle,,$5,Global Culture,English,I will help you find your dream car,https://www.fiverr.com/hiltcar/help-you-find-your-dream-car,hiltcar,,,United States,1 Hrs.
Fun & Lifestyle,,$5,Global Culture,"English, Spanish, Italian",I will travel planner specialised in Spain,https://www.fiverr.com/eliafacc/plan-your-travel-in-spain,eliafacc,100%,,Italy,1 Hrs.
Programming & Tech,,$5,User Testing,"English, French",I will create a usability report for your needs,https://www.fiverr.com/nataliea_/create-a-usability-report-for-your-needs,nataliea_,100%,,Australia,1 Hrs.
Programming & Tech,rating-circles star-rating-s12 rate-10,$5,User Testing,,I will test your app with my iPhone,https://www.fiverr.com/sdkaycee/test-your-app-with-my-iphone,sdkaycee,100%,(2),United States,7 Hrs.
Fun & Lifestyle,,$5,Global Culture,English,I will show you a beautiful tourist spot in Indonesia,https://www.fiverr.com/salabindun/show-you-a-beautiful-tourist-spot-in-indonesia,salabindun,,,Indonesia,1 Hrs.
Fun & Lifestyle,rating-circles star-rating-s12 rate-10,$5,Astrology & Readings,,I will cast an ancient binding spell of protection to protect you from anything,https://www.fiverr.com/modernwitch/cast-an-ancient-binding-spell-of-protection-to-protect-you-from-anything,modernwitch,100%,(150),Canada,11 Hrs.
Programming & Tech,,$5,User Testing,English,I will be your professional usability and UX tester and consultant,https://www.fiverr.com/business_pro_/be-your-usability-consultant-and-provide-detailed-feedback,business_pro_,,,United Kingdom,16 Hrs.
Programming & Tech,,$10,User Testing,English,I will website Testing to make user experience better,https://www.fiverr.com/bhumikapandey/website-testing-to-make-user-experience-better,bhumikapandey,,,India,6 Days
Programming & Tech,,$400,User Testing,English,I will do all types of exploit tests on your website,https://www.fiverr.com/gandubacha/do-all-types-of-exploit-tests-on-your-website,gandubacha,,,India,1 Hrs.
Fun & Lifestyle,rating-circles star-rating-s12 rate-10,$5,Astrology & Readings,English,I will perform magical LOVE spell,https://www.fiverr.com/psychicvunga/perform-magical-love-spell,psychicvunga,100%,(97),Croatia,7 Hrs.
Programming & Tech,,$5,User Testing,"English, Indonesian, German",I will provide user test for your website and help you to improve,https://www.fiverr.com/c0mr4de/test-your-website-and-give-feedback,c0mr4de,,,Indonesia,1 Hrs.
Programming & Tech,,$5,User Testing,"English, Malay",I will test your Windows or Android game,https://www.fiverr.com/wolfehcodes/test-your-apps-for-you,wolfehcodes,,,Malaysia,1 Hrs.
Fun & Lifestyle,,$5,Global Culture,English,I will search AirBnB for your place to stay,https://www.fiverr.com/erind17/search-airbnb-for-your-place-to-stay,erind17,100%,,Canada,1 Hrs.
Fun & Lifestyle,rating-circles star-rating-s12 rate-10,$5,Celebrity Impersonators,,I will let President Obama Endorse Promote Advertise Greet Market your videos,https://www.fiverr.com/chix_gig_it/let-barack-obama-show-your-video-in-his-ipad-847208db-6605-42bc-a000-53052ce9b189?context=adv.cat_7.subcat_319&context_type=rating&source=gallery-listing&ref_ctx_id=35228a0b-42ad-47a0-85e3-9139a7806d7c&filtered_price=&pckg_id=1&pos=15&funnel=544be4a4-8bfe-433a-81db-0b311a8e5ecc,chix_gig_it,99%,(60),Philippines,1 Hrs.
Fun & Lifestyle,rating-circles star-rating-s12 rate-0,$5,Global Culture,English,"I will give you tips on your vacation in Maui, HI",https://www.fiverr.com/ponymessenger/give-you-tips-on-your-vacation-in-maui-hi,ponymessenger,,(1),United States,1 Hrs.
Programming & Tech,,$5,User Testing,English,I will act as a user and test your website,https://www.fiverr.com/igogiko/act-as-a-user-and-test-your-website,igogiko,,,Finland,1 Hrs.
Programming & Tech,,$5,User Testing,"Malayalam, English, Hindi",I will test websites android apps to its extreme,https://www.fiverr.com/techweed/test-websites-android-apps-to-its-extreme,techweed,,,India,1 Hrs.
Programming & Tech,,$10,User Testing,"Malay, English",I will do application or software testing,https://www.fiverr.com/mimiloma/do-application-or-software-testing,mimiloma,,,Malaysia,1 Hrs.
Graphics & Design,rating-circles star-rating-s12 rate-10,$5,Logo Design,"English, French, German",I will design PROFESSIONAL brand logo for your business,https://www.fiverr.com/logoabi/design-professional-brand-logo-for-your-business,logoabi,98%,(306),Pakistan,1 Hrs.
Programming & Tech,,$5,User Testing,English,"I will stress test your software, app, or games",https://www.fiverr.com/btsukerman/stress-test-your-software-app-or-games,btsukerman,,,United States,1 Hrs.
Programming & Tech,,$5,User Testing,English,I will test any PC or Mac game,https://www.fiverr.com/pctester/test-any-pc-or-mac-game,pctester,,,United Kingdom,1 Hrs.
Graphics & Design,rating-circles star-rating-s12 rate-10,$5,Vector Tracing,"English, Indonesian","I will trace,convert or redraw your Sketch logo to vector in 12 hours",https://www.fiverr.com/choir_design/convert-your-sketch-logo-to-vector-in-12-hours,choir_design,100%,(17),Indonesia,4 Hrs.
Programming & Tech,,$5,User Testing,"Urdu, English",I will test your website,https://www.fiverr.com/pinkabelle/test-your-website-from-a-female-perspective,pinkabelle,85%,,Pakistan,7 Hrs.
Fun & Lifestyle,,$5,Global Culture,English,I will send you this ebook about travel by ecotourism,https://www.fiverr.com/traveler82/send-you-this-ebook-about-travel-by-ecotourism,traveler82,100%,,United States,9 Hrs.
Programming & Tech,,$5,User Testing,"English (uk), Hindi, Tamil, English",I will test your website from a users perspective and record it,https://www.fiverr.com/nikunj_rathi/test-your-website-from-a-users-perspective-and-record-it,nikunj_rathi,,,India,1 Hrs.
Fun & Lifestyle,,$5,Global Culture,English,I will answer a question about planning a trip to Disneyland,https://www.fiverr.com/schmeeley/answer-a-question-about-planning-a-trip-to-disneyland,schmeeley,,,United States,1 Hrs.
Programming & Tech,,$10,User Testing,English,I will do Salesforce functional testing,https://www.fiverr.com/sonali267/do-salesforce-functional-testing,sonali267,,,India,2 Days
Fun & Lifestyle,,$5,Global Culture,English,I will help you experience  suburban Midwestern America from anywhere,https://www.fiverr.com/artlifeoriginal/take-an-architecture-photo-in-my-hometown-that-you-can-use,artlifeoriginal,99%,,United States,12 Hrs.
Programming & Tech,,$5,User Testing,"Spanish, English",I will test your apps or web sites,https://www.fiverr.com/wilmerjosetovar/test-your-apps-or-web-sites,wilmerjosetovar,,,Venezuela,1 Hrs.
Fun & Lifestyle,,$5,Global Culture,English,I will be your itinerary maker,https://www.fiverr.com/nora_diela1103/be-your-itinerary-maker,nora_diela1103,,,Malaysia,1 Hrs.
Graphics & Design,rating-circles star-rating-s12 rate-10,$5,Vector Tracing,"English, Arabic",I will vectorise or redraw your logo or draw image,https://www.fiverr.com/minemine88/vectorise-or-redraw-your-logo-or-draw-image,minemine88,99%,(120),Egypt,7 Hrs.
Fun & Lifestyle,,$5,Global Culture,English,I will help you plan your trip to Italy,https://www.fiverr.com/grace2014/help-you-plan-your-trip-to-italy,grace2014,100%,,Italy,2 Days
Programming & Tech,,$5,User Testing,English,I will give your website a grate test for user experience,https://www.fiverr.com/abrehamkenfe/give-your-website-a-grate-test-for-user-experience,abrehamkenfe,,,United States,1 Hrs.
Fun & Lifestyle,,$5,Global Culture,English,I will answer 10 questions about Indonesia,https://www.fiverr.com/salabindun/answer-10-questions-about-indonesia,salabindun,,,Indonesia,1 Hrs.
Fun & Lifestyle,,$5,Global Culture,"English, Vietnamese",I will give you 5 images about Lunar New Year holiday and festival,https://www.fiverr.com/tienduc/give-you-5-images-about-lunar-new-year-holiday-and-festival,tienduc,,,Vietnam,1 Hrs.
Digital Marketing,rating-circles star-rating-s12 rate-10,$5,Influencer Marketing,,I will feature your brand in my FASHION blog magazine,https://www.fiverr.com/bia4online/feature-your-brand-in-my-fashion-blog-magazine,bia4online,99%,(58),Pakistan,1 Hrs.
Fun & Lifestyle,,$5,Global Culture,English,I will send you four handmade fashion postcards,https://www.fiverr.com/couturepost/send-you-four-handmade-fashion-postcards,couturepost,,,United States,1 Hrs.
Programming & Tech,,$5,User Testing,English,I will test your website and give suggestions,https://www.fiverr.com/iyazinawwarah/test-your-website-and-give-suggestions,iyazinawwarah,,,Malaysia,1 Hrs.
Digital Marketing,,$45,Influencer Marketing,English,I will host your giveaway on my blog,https://www.fiverr.com/crsnuggs/host-your-giveaway-on-my-blog,crsnuggs,100%,,United States,1 Hrs.
Graphics & Design,rating-circles star-rating-s12 rate-10,$10,Logo Design,"English, French, Italian, German",I will design PROFESSIONAL brand logo for your business,https://www.fiverr.com/logo_vision/design-professional-and-unique-logo-with-2-variation,logo_vision,98%,(864),Pakistan,1 Hrs.
Programming & Tech,,$5,User Testing,English,I will create test cases quickly by using system requirements,https://www.fiverr.com/rajinder1313/create-test-cases-quickly-by-using-system-requirements,rajinder1313,,,India,16 Hrs.
Fun & Lifestyle,,$5,Global Culture,English,I will create a spa itinerary for your Jamaican vacation,https://www.fiverr.com/dwillz/create-a-spa-itinerary-for-your-jamaican-vacation,dwillz,98%,,Jamaica,13 Hrs.
Programming & Tech,,$5,User Testing,English,I will perform testing of software and website,https://www.fiverr.com/salmanahmed117/perform-testing-of-software-and-website,salmanahmed117,,,India,1 Hrs.
Fun & Lifestyle,,$5,Global Culture,English,I will find you the best prices on flights for your next trip,https://www.fiverr.com/mydeme/find-you-the-best-prices-on-flights-for-your-next-trip,mydeme,100%,,United States,1 Day
Programming & Tech,,$20,User Testing,English,I will play your games anytime Photoshop your picture too,https://www.fiverr.com/kornx1988/play-your-games-anytime-photoshop-your-picture-too,kornx1988,,,United States,1 Hrs.
Fun & Lifestyle,,$5,Global Culture,English,I will send a postcard from Thai to Anywhere in the World,https://www.fiverr.com/ziobit/send-a-postcard-from-thai-to-anywhere-in-the-world,ziobit,80%,,Italy,7 Hrs.
Programming & Tech,,$5,User Testing,English,I will test your website for functionality,https://www.fiverr.com/matthewatkins/test-your-website-for-functionality,matthewatkins,,,Australia,1 Hrs.
Fun & Lifestyle,,$5,Global Culture,"English, Hindi, Marathi, Italian",I will be your personal  online travel guide,https://www.fiverr.com/traveljunglee/be-your-personal-online-travel-guide,traveljunglee,,,India,3 Hrs.
Fun & Lifestyle,rating-circles star-rating-s12 rate-9,$5,Celebrity Impersonators,,I will voice anything as Rod Serling from The Twilight Zone,https://www.fiverr.com/rapkat22543/voice-anything-as-rod-serling-from-the-twilight-zone?context=adv.cat_7.subcat_319&context_type=rating&source=gallery-listing&ref_ctx_id=35228a0b-42ad-47a0-85e3-9139a7806d7c&filtered_price=&pckg_id=1&pos=29&funnel=544be4a4-8bfe-433a-81db-0b311a8e5ecc,rapkat22543,91%,(6),United States,1 Hrs.
Programming & Tech,,$5,User Testing,English,I will do mobile and cross browser website testing,https://www.fiverr.com/waterninja20/do-mobile-and-cross-browser-website-testing,waterninja20,,,United States,1 Hrs.
Fun & Lifestyle,rating-circles star-rating-s12 rate-9,$5,Online Lessons,,I will help you in networking assignments and tasks,https://www.fiverr.com/mubashirebad93/help-you-in-networking-assignments,mubashirebad93,95%,(32),Pakistan,2 Hrs.
Graphics & Design,rating-circles star-rating-s12 rate-10,$5,Cartoons & Caricatures,"Urdu, English (uk)",I will draw your GTA style cartoon portrait,https://www.fiverr.com/rizwan_xadiq/draw-your-gta-style-cartoon-portrait,rizwan_xadiq,99%,(72),Pakistan,1 Hrs.
Programming & Tech,,$5,User Testing,English,I will test your website from a users perspective and record it,https://www.fiverr.com/rukewetony/test-your-website-from-a-users-perspective-and-record-it,rukewetony,,,Nigeria,1 Hrs.
Programming & Tech,,$5,User Testing,"English, French, Hungarian, Arabic",I will provide reliable and accurate transcription,https://www.fiverr.com/salemchem/provide-reliable-and-accurate-transcription,salemchem,,,Luxembourg,1 Hrs.
Programming & Tech,,$5,User Testing,"English, German",I will test your iOS Game,https://www.fiverr.com/satanko_works/test-your-ios-game,satanko_works,,,Austria,1 Hrs.
Fun & Lifestyle,,$5,Global Culture,English,I will assist u to lrn BENGALI language,https://www.fiverr.com/h_ahmed/teach-bengali-language-to-you,h_ahmed,,,Bangladesh,1 Day
Digital Marketing,,$700,Marketing Strategy,"English, Spanish, French, Thai",I will design and run your digital marketing strategy,https://www.fiverr.com/marcgras/design-and-run-your-digital-marketing-strategy,marcgras,,,Thailand,3 Hrs.
Programming & Tech,,$15,User Testing,"English (uk), Hindi",I will do testing and data entry,https://www.fiverr.com/shailu1/do-testing-and-data-entry,shailu1,,,India,1 Hrs.
Fun & Lifestyle,,$5,Global Culture,English,I will send a postcard from the city of Portland,https://www.fiverr.com/impactgrace/send-a-postcard-from-the-city-of-portland,impactgrace,,,United States,1 Hrs.
Graphics & Design,rating-circles star-rating-s12 rate-10,$5,Logo Design,English,I will design your logo into 3d dazzling metallic gold,https://www.fiverr.com/judetonn/replicate-your-logo-into-3d-sparkling-metallic-gold,judetonn,97%,(916),India,1 Hrs.
Digital Marketing,,$5,Marketing Strategy,English,I will put your logo on 5 videos and upload them to Youtube,https://www.fiverr.com/marketinghere/put-your-logo-on-5-videos-and-upload-them-to-youtube,marketinghere,99%,,Colombia,5 Hrs.
Fun & Lifestyle,,$5,Global Culture,English,I will create an itinerary for your travels,https://www.fiverr.com/cam408962/create-an-itinerary-for-your-travels,cam408962,,,United States,1 Hrs.
Programming & Tech,,$10,User Testing,English,I will test Your  mobile application or website on PC or Android,https://www.fiverr.com/cjxsolutions/test-your-mobile-application-or-website-on-pc-or-android,cjxsolutions,,,United States,1 Hrs.
Fun & Lifestyle,,$10,Global Culture,"English, Malay, Chinese",I will create an itinerary for your travel destination,https://www.fiverr.com/chucks223/create-an-itinerary-for-your-travel-destination,chucks223,98%,,Malaysia,1 Hrs.
Fun & Lifestyle,,$5,Global Culture,English,I will send you a postcard from London,https://www.fiverr.com/starlily/send-you-a-postcard-from-london,starlily,,,United Kingdom,5 Hrs.
Fun & Lifestyle,,$5,Global Culture,English,I will plan your trip to India tour,https://www.fiverr.com/dineshchoudhary/plan-your-trip-to-india-tour,dineshchoudhary,,,India,1 Hrs.
Fun & Lifestyle,,$5,Global Culture,"English, Polish, Yoruba",I will answer any question about NIGERIA,https://www.fiverr.com/seyide/answer-any-question-about-nigeria,seyide,,,Poland,1 Hrs.
Graphics & Design,rating-circles star-rating-s12 rate-10,$5,Logo Design,English,I will do Embroidery Digitizing in 4 hours,https://www.fiverr.com/jennadigitizer/do-embroidery-digitizing-on-4-to-24hours,jennadigitizer,100%,(486),Pakistan,1 Hrs.
Graphics & Design,rating-circles star-rating-s12 rate-10,$15,Logo Design,English,I will do BUSINESS logo design,https://www.fiverr.com/idezinefr/design-3-logo-designs,idezinefr,99%,(110),Canada,6 Hrs.
Fun & Lifestyle,,$5,Global Culture,English,I will send you four handmade wedding postcards,https://www.fiverr.com/couturepost/send-you-four-handmade-wedding-postcards,couturepost,,,United States,1 Hrs.
Programming & Tech,,$5,User Testing,English,I will work is done smartly,https://www.fiverr.com/chahatbahl/work-is-done-smartly-843d0a01-9d45-4c9a-bf74-936a22aa235c,chahatbahl,,,India,1 Hrs.
Graphics & Design,rating-circles star-rating-s12 rate-9,$5,Infographics,,I will design an Unique eye catching infographic,https://www.fiverr.com/eisha_tahir/design-an-unique-eye-catching-infographic,eisha_tahir,97%,(12),Pakistan,10 Hrs.
Fun & Lifestyle,,$5,Global Culture,English,I will answer any questions about my beautiful COUNTRY Sri Lanka,https://www.fiverr.com/mantrachaarya/answer-4-questions-about-sacred-places-in-anuradhapura,mantrachaarya,87%,,Sri Lanka,20 Hrs.
Programming & Tech,,$15,User Testing,English,I will do USER experience testing on your website and website audit,https://www.fiverr.com/motonel/do-user-experience-testing-on-your-website-and-website-audit,motonel,,,Canada,12 Hrs.
Fun & Lifestyle,,$5,Global Culture,"English, French",I will send random postcard from africa,https://www.fiverr.com/postalcard/send-random-postcard-from-africa,postalcard,93%,,Cameroon,12 Hrs.
Graphics & Design,rating-circles star-rating-s12 rate-10,$5,Logo Design,"English, French, Arabic, German",I will design 2 Amazing Logo With eyecatching presentation,https://www.fiverr.com/designsforrest/design-eye-catching-logo-with-express-delivery,designsforrest,99%,(1833),Pakistan,3 Hrs.
Fun & Lifestyle,,$5,Global Culture,"Spanish, English (uk), Bengali",I will guide you how to learn a language,https://www.fiverr.com/namedfarhad/guide-you-how-to-learn-a-language,namedfarhad,90%,,Bangladesh,4 Hrs.
Programming & Tech,,$5,User Testing,"English, Urdu","I will test a website ,black box and white box testing",https://www.fiverr.com/suhussain/test-a-website-black-box-and-white-box-testing,suhussain,90%,,Pakistan,4 Hrs.
Fun & Lifestyle,,$5,Global Culture,"English, Spanish, German, French",I will be your Travel Planner anywhere in Egypt,https://www.fiverr.com/essamsaad/be-your-travel-planner-anywhere-in-egypt,essamsaad,,,Egypt,8 Hrs.
Graphics & Design,rating-circles star-rating-s12 rate-10,$5,Vector Tracing,,I will convert your any logo into vector format ASAP,https://www.fiverr.com/vectorpix/convert-your-any-logo-into-vector-format-asap,vectorpix,98%,(52),Pakistan,2 Hrs.
Programming & Tech,,$220,User Testing,English,I will test your web app and mobile app for functional and performance,https://www.fiverr.com/rajpatel387/test-your-web-app-and-mobile-app-for-functional-and-performance,rajpatel387,,,India,1 Hrs.
Fun & Lifestyle,rating-circles star-rating-s12 rate-10,$5,Astrology & Readings,,I will do a future PSYCHIC reading for anything,https://www.fiverr.com/johnnycake100/tell-you-accurately-your-future,johnnycake100,99%,(534),Jamaica,1 Hrs.
Programming & Tech,,$5,User Testing,"English, Hindi",I will test your Website and give PDF report,https://www.fiverr.com/yash1091997/test-your-website-and-give-pdf-report,yash1091997,,,India,1 Hrs.
Digital Marketing,,$15,Marketing Strategy,English,I will write a full digital marketing strategy,https://www.fiverr.com/ben_twenty/write-a-full-digital-marketing-strategy,ben_twenty,,,Australia,11 Hrs.
Graphics & Design,,$15,Infographics,"English, Indonesian",I will design your modern infographic,https://www.fiverr.com/rofiatin/make-your-professional-infographic,rofiatin,95%,,Indonesia,3 Hrs.
Programming & Tech,,$5,User Testing,English,"I will test your website,android app to find problems",https://www.fiverr.com/gunhz1234/test-your-website-android-app-to-find-problems,gunhz1234,,,Romania,16 Hrs.
Fun & Lifestyle,,$5,Global Culture,"Spanish, English",I will plan special trips in Spain,https://www.fiverr.com/balto201/plan-special-trips-in-spain,balto201,,,Spain,1 Hrs.
Fun & Lifestyle,,$5,Global Culture,"Spanish, English, Romanian",I will send you a beautiful postcard from Peru,https://www.fiverr.com/mirceadobre78/send-you-a-beautiful-postcard-of-your-choice-from-peru,mirceadobre78,100%,,Peru,1 Day
Graphics & Design,rating-circles star-rating-s12 rate-10,$5,Vector Tracing,,I will make vector files of your design suitable for vinyl cutters,https://www.fiverr.com/keefrog/make-vector-files-of-your-design-suitable-for-vinyl-cutters,keefrog,100%,(139),United Kingdom,5 Hrs.
Graphics & Design,rating-circles star-rating-s12 rate-10,$5,Logo Design,English (uk),I will design a unique business logo,https://www.fiverr.com/sana_kdesign/design-a-unique-business-logo,sana_kdesign,99%,(224),United Kingdom,1 Hrs.
Fun & Lifestyle,,$20,Global Culture,English,I will plan your national park vacation,https://www.fiverr.com/jamesfester/design-your-next-presentation,jamesfester,,,United States,1 Hrs.
Programming & Tech,,$10,User Testing,"English, Hindi, Tamil, Malayalam",I will test Your App Or Website as an End user,https://www.fiverr.com/pgrams2222/test-your-app-or-website-as-an-end-user,pgrams2222,,,India,1 Hrs.
